"概要","説明","開催期間","開催地","目的","エリア","詳細URL"
"九度山・真田ミュージアム企画展「兜－戦いのデザイン－」（協力：一般社団法人日本甲冑武具研究保存会近畿支部など）","日本刀と並び、それぞれの武将を表すシンボルとされた様々に意匠をこらした兜が展示されます。※兜展示は期間中、2カ月毎に入れ替えを行います。※体験コーナーでは、折り…","～3月29日（日）","九度山・真田ミュージアム","観る","九度山町","https://www.wakayama-kanko.or.jp/event/detail.php?id=17685"
"みなべフォトコンテスト","みなべ町の「きれい」「かわいい」「おもしろい」写真を投稿しよう！みなべ観光協会アカウント「@minabe_kanko」をフォローして「＃フォトコンみなべ」をつけ…","～3月31日（火）","みなべ町","","みなべ町","https://www.wakayama-kanko.or.jp/event/detail.php?id=17692"
"田辺のうまい昼ご飯あがら丼2019","「お昼も田辺らしい食事をしたい！」という観光客の皆様からの御希望にお応えし、期間限定のオリジナル丼を市内の店舗にて提供致します。","～2020年3月31日(火）","田辺市内","食べる / お土産・逸品","田辺市","https://www.wakayama-kanko.or.jp/event/detail.php?id=17696"
"弁慶市","闘?神社の馬場にて地場産品を格安で販売する月1回の朝市で朝早くから賑わいます。","通年（毎月第3日曜日）","闘?神社","お土産・逸品 / 食べる","田辺市","https://www.wakayama-kanko.or.jp/event/detail.php?id=17854"
"2019年度春期企画展「高野山と不思議な話」","高野山を開創した弘法大師空海は非常に多くの伝承が全国各地に残されており、これほど多くの伝承が残っている人物は日本でも稀だといえます。また、高野山は1200年も前…","～7月15日(祝・月)","高野山霊宝館","世界遺産 / 観る","高野町","https://www.wakayama-kanko.or.jp/event/detail.php?id=17462"
"熊野川水系あまご漁解禁","熊野川本流と大塔川、四村川、三越川、赤木川、高田川の支流であまご漁が解禁されます。＊組合員以外は年券もしくは一日券が必要","～9月30日（土）","","","田辺市・新宮市","https://www.wakayama-kanko.or.jp/event/detail.php?id=17473"
"熊野川水系あまご漁解禁","熊野川本流と大塔川、四村川、三越川、赤木川、高田川の支流であまご漁が解禁されます。＊組合員以外は年券もしくは一日券が必要","～9月30日（月）","","","新宮市","https://www.wakayama-kanko.or.jp/event/detail.php?id=17700"
"古座川水系あまご漁解禁","古座川本流（河口より七川ダム堰堤まで）と、小川、佐本川、三尾川の各支流であまご漁が解禁されます。＊組合員以外は年券もしくは一日券が必要","～9月30日（月）","","","古座川町・串本町","https://www.wakayama-kanko.or.jp/event/detail.php?id=17701"
"和歌浦漁港　おっとっと広場","和歌浦湾で獲れる「わかしらす」など新鮮な魚介類や水産加工品を直販価格で販売する販売ブースがあります。","通年（毎週土・日・祝）","和歌浦漁港おっとっと広場","食べる / お土産・逸品","和歌山市","https://www.wakayama-kanko.or.jp/event/detail.php?id=17674"
"雑賀崎漁港　船からの直接販売","和歌山市南西部に位置する底引き網漁が盛んな雑賀崎漁港。獲れたての魚介類が船上から直接販売されます。","通年（火・土・祝前日休み）※それ以外も中止の場合あり（要問合せ）","雑賀崎漁港","お土産・逸品","和歌山市","https://www.wakayama-kanko.or.jp/event/detail.php?id=17675"
"熊野曼荼羅絵解き","地元ガイドが、世界遺産となった熊野と熊野古道の魅力をわかりやすく、また興味深く絵解き（解説）します。＊開催時間は天候により変動あり・雨天中止","①毎週土・日及び祝の開催　②毎週日曜日開催","①川原家横丁②神倉神社","世界遺産","新宮市","https://www.wakayama-kanko.or.jp/event/detail.php?id=17678"
"和歌浦漁港　おっとっと広場","和歌浦湾で獲れる「わかしらす」など新鮮な魚介類や水産加工品を直販価格で販売する販売ブースがあります。","通年（毎週土・日・祝）　＊8月10日(土)～12日(祝・月)はお盆休み","和歌浦漁港おっとっと広場","食べる / お土産・逸品","和歌山市","https://www.wakayama-kanko.or.jp/event/detail.php?id=17852"
"雑賀崎漁港　船からの直接販売","和歌山市南西部に位置する底引き網漁が盛んな雑賀崎漁港。獲れたての魚介類が船上から直接販売されます。","通年（火・土・祝前日休み）※それ以外も中止の場合あり（要問合せ）","雑賀崎漁港","お土産・逸品","和歌山市","https://www.wakayama-kanko.or.jp/event/detail.php?id=17853"
"熊野曼荼羅絵解き","地元ガイドが、世界遺産となった熊野と熊野古道の魅力をわかりやすく、また興味深く絵解き（解説）します。＊開催時間は天候により変動あり・雨天中止","①毎週土・日及び祝の開催　②毎週日曜日開催","①川原家横丁②神倉神社","世界遺産","新宮市","https://www.wakayama-kanko.or.jp/event/detail.php?id=17855"
"佐本川柱松","佐本川地域の夏の風物詩柱松に火を投げ入れます。","8月16日（金）","佐本小学校","観る / 観る","すさみ町","https://www.wakayama-kanko.or.jp/event/detail.php?id=17781"
"粉河祭宵祭、本祭","紀州三大祭のひとつ。粉河駅前から粉河寺大門までの｢粉河とんまか通り｣にきらびやかに飾りつけられた｢だんじり｣が並び、宵祭の夜にはそれぞれの｢だんじり｣の提燈に火…","7月27日（土）、28（日）","粉河産??神社および粉河とんまか通り周辺","観る / 遊び・体験","紀の川市","https://www.wakayama-kanko.or.jp/event/detail.php?id=17578"
"STARPARTY in KIMINO ペルセウス座流星群観望会","夏を代表する天体ショー「ペルセウス座流星群」、楽しい星空解説、望遠鏡で土星・木星・月面を覗くなどの体験ができる特別イベントを開催！アイリッシュ・カントリーミュー…","8月12日（振休・月）","紀美野町文化センター","遊び・体験","紀美野町","https://www.wakayama-kanko.or.jp/event/detail.php?id=17754"
"観光ぶどう園「有田巨峰村」ぶどう狩り","有田川中流、川口地区の山間部に広がる約40haの関西一巨大観光ぶどう園。甘味たっぷりの巨峰ぶどうの産地として有名です。8月中旬には開村イベントも開催されます。","8月中旬～9月30日（月）","有田巨峰村","遊び・体験 / 食べる","有田川町","https://www.wakayama-kanko.or.jp/event/detail.php?id=17630"
"観光ぶどう園「有田巨峰村」ぶどう狩り","有田川中流、川口地区の山間部に広がる約40haの関西一巨大観光ぶどう園。甘味たっぷりの巨峰ぶどうの産地として有名です。８月中旬には開村イベントも開催されます。","8月中旬～9月30日（月）","有田巨峰村","遊び・体験 / 食べる","有田川町","https://www.wakayama-kanko.or.jp/event/detail.php?id=17760"
